{
  "schema_version": "1.0",
  "run_id": "RUN-038aeaa2-c00b-4e5d-a049-98185e4d14b0-R1-C1",
  "artifact_id": "ART-95abba68",
  "artifact_type": "assessment_public",
  "agent": "tiered-evaluator",
  "status": "ready",
  "versions": {
    "prompt_version": "c-prompts-1.21.1",
    "model_config_hash": "MODEL-a54018547a29e463ea39ed85fb28e89564b7c613d55e5aaead755028568e9f40",
    "runner_image_digest": "sha256:795ed9486f10d55376e185115d5d801bc3ed51398752109b271f4c63a8356a5b",
    "profile_version": "RUN-038aeaa2-c00b-4e5d-a049-98185e4d14b0-profile-E0",
    "kb_version": "0.6.0",
    "rag_version": "rule-rag-0.1",
    "schema_version": "1.0"
  },
  "seed": 85243021950063,
  "input_refs": [
    "SPEC-bfaaa47c",
    "RAG-0dddefb21a79493d79f65032",
    "ART-25dad186"
  ],
  "citations": [
    {
      "source_id": "K001",
      "fact_id": "F001",
      "relation": "derived_from"
    },
    {
      "source_id": "K001",
      "fact_id": "F002",
      "relation": "derived_from"
    },
    {
      "source_id": "K001",
      "fact_id": "F003",
      "relation": "derived_from"
    }
  ],
  "quality": {
    "schema_ok": true,
    "citation_coverage": 1,
    "objective_coverage": 1,
    "alignment_score": 1,
    "answer_key_verified": true,
    "verified_test_count": 0,
    "verified_item_count": 5
  },
  "payload": {
    "form_id": "FORM-38af5529",
    "title": "Python 是什么 基础测评",
    "objective_ids": [
      "OBJ-K001"
    ],
    "items": [
      {
        "item_id": "ITEM-7bc54029",
        "family_id": "FAMILY-d819f68e",
        "variant_id": "VARIANT-9e9cdce0",
        "display_no": 1,
        "objective_id": "OBJ-K001",
        "tier": 1,
        "modality": "mcq",
        "max_score": 1,
        "citations": [
          {
            "source_id": "K001",
            "fact_id": "F001",
            "relation": "derived_from"
          },
          {
            "source_id": "K001",
            "fact_id": "F002",
            "relation": "derived_from"
          },
          {
            "source_id": "K001",
            "fact_id": "F003",
            "relation": "derived_from"
          }
        ],
        "prompt": "Python 是一种什么类型的编程语言？",
        "options": [
          {
            "option_id": "OPTION-c026cd9f",
            "label": "A",
            "text": "只能用于数据处理的专用语言"
          },
          {
            "option_id": "OPTION-c02d8964",
            "label": "B",
            "text": "只能用于编写脚本的专用语言"
          },
          {
            "option_id": "OPTION-c42b5119",
            "label": "C",
            "text": "只能用于教学示例的专用语言"
          },
          {
            "option_id": "OPTION-c4291282",
            "label": "D",
            "text": "通用编程语言"
          }
        ]
      },
      {
        "item_id": "ITEM-c30eaf60",
        "family_id": "FAMILY-d819f68e",
        "variant_id": "VARIANT-518641f9",
        "display_no": 2,
        "objective_id": "OBJ-K001",
        "tier": 1,
        "modality": "mcq",
        "max_score": 1,
        "citations": [
          {
            "source_id": "K001",
            "fact_id": "F001",
            "relation": "derived_from"
          },
          {
            "source_id": "K001",
            "fact_id": "F002",
            "relation": "derived_from"
          },
          {
            "source_id": "K001",
            "fact_id": "F003",
            "relation": "derived_from"
          }
        ],
        "prompt": "Python 程序通常由什么执行？",
        "options": [
          {
            "option_id": "OPTION-94a90e83",
            "label": "A",
            "text": "解释器"
          },
          {
            "option_id": "OPTION-98ab5366",
            "label": "B",
            "text": "编译器"
          },
          {
            "option_id": "OPTION-94afca48",
            "label": "C",
            "text": "汇编器"
          },
          {
            "option_id": "OPTION-98ad91fd",
            "label": "D",
            "text": "链接器"
          }
        ]
      },
      {
        "item_id": "ITEM-3f2effb7",
        "family_id": "FAMILY-5b0590bb",
        "variant_id": "VARIANT-23b5a05e",
        "display_no": 3,
        "objective_id": "OBJ-K001",
        "tier": 2,
        "modality": "true_false",
        "max_score": 2,
        "citations": [
          {
            "source_id": "K001",
            "fact_id": "F001",
            "relation": "derived_from"
          },
          {
            "source_id": "K001",
            "fact_id": "F002",
            "relation": "derived_from"
          },
          {
            "source_id": "K001",
            "fact_id": "F003",
            "relation": "derived_from"
          }
        ],
        "prompt": "Python 只能用来编写脚本和数据处理程序，不能用于其他类型的编程任务。",
        "options": [
          {
            "option_id": "OPTION-e541ea5f",
            "label": "A",
            "text": "正确"
          },
          {
            "option_id": "OPTION-e945c242",
            "label": "B",
            "text": "错误"
          }
        ]
      },
      {
        "item_id": "ITEM-abdd3ba0",
        "family_id": "FAMILY-5b0590bb",
        "variant_id": "VARIANT-eafc74bd",
        "display_no": 4,
        "objective_id": "OBJ-K001",
        "tier": 2,
        "modality": "true_false",
        "max_score": 2,
        "citations": [
          {
            "source_id": "K001",
            "fact_id": "F001",
            "relation": "derived_from"
          },
          {
            "source_id": "K001",
            "fact_id": "F002",
            "relation": "derived_from"
          },
          {
            "source_id": "K001",
            "fact_id": "F003",
            "relation": "derived_from"
          }
        ],
        "prompt": "Python 程序在运行之前必须经过单独的编译步骤。",
        "options": [
          {
            "option_id": "OPTION-d8b1de36",
            "label": "A",
            "text": "错误"
          },
          {
            "option_id": "OPTION-d4af9953",
            "label": "B",
            "text": "正确"
          }
        ]
      },
      {
        "item_id": "ITEM-55cdf063",
        "family_id": "FAMILY-d819f68e",
        "variant_id": "VARIANT-975e3a52",
        "display_no": 5,
        "objective_id": "OBJ-K001",
        "tier": 3,
        "modality": "mcq",
        "max_score": 4,
        "citations": [
          {
            "source_id": "K001",
            "fact_id": "F001",
            "relation": "derived_from"
          },
          {
            "source_id": "K001",
            "fact_id": "F002",
            "relation": "derived_from"
          },
          {
            "source_id": "K001",
            "fact_id": "F003",
            "relation": "derived_from"
          }
        ],
        "prompt": "以下关于 Python 的说法，哪一项是正确的？",
        "options": [
          {
            "option_id": "OPTION-d866cebf",
            "label": "A",
            "text": "Python 程序必须经过编译才能运行。"
          },
          {
            "option_id": "OPTION-d86f1d84",
            "label": "B",
            "text": "Python 只能用于编写脚本，不能用于数据处理。"
          },
          {
            "option_id": "OPTION-dc6b5239",
            "label": "C",
            "text": "Python 只能用于教学示例，不能用于实际项目。"
          },
          {
            "option_id": "OPTION-dc6913a2",
            "label": "D",
            "text": "Python 是一种通用编程语言，可以用于多种类型的编程任务。"
          }
        ]
      }
    ],
    "submission_policy": {
      "max_attempts": 3,
      "formative": true
    },
    "routing": {
      "anchor_item_ids": [
        "ITEM-7bc54029",
        "ITEM-c30eaf60",
        "ITEM-3f2effb7"
      ],
      "rules": [
        {
          "route_id": "ROUTE-REMEDIATE",
          "min_anchor_score_ratio": 0,
          "max_anchor_score_ratio": 0.4,
          "action": "remediate",
          "reveal_tiers": [
            1
          ]
        },
        {
          "route_id": "ROUTE-REINFORCE",
          "min_anchor_score_ratio": 0.4,
          "max_anchor_score_ratio": 0.8,
          "action": "reinforce",
          "reveal_tiers": [
            1,
            2
          ]
        },
        {
          "route_id": "ROUTE-ADVANCE",
          "min_anchor_score_ratio": 0.8,
          "max_anchor_score_ratio": 1,
          "action": "advance",
          "reveal_tiers": [
            2,
            3
          ]
        }
      ]
    },
    "objective_coverage": [
      {
        "objective_id": "OBJ-K001",
        "item_ids": [
          "ITEM-7bc54029",
          "ITEM-c30eaf60",
          "ITEM-3f2effb7",
          "ITEM-abdd3ba0",
          "ITEM-55cdf063"
        ],
        "modalities": [
          "mcq",
          "true_false"
        ]
      }
    ],
    "used_evidence": [
      {
        "source_id": "K001",
        "fact_id": "F001",
        "relation": "derived_from"
      },
      {
        "source_id": "K001",
        "fact_id": "F002",
        "relation": "derived_from"
      },
      {
        "source_id": "K001",
        "fact_id": "F003",
        "relation": "derived_from"
      }
    ]
  },
  "trace_ref": "TRACE-da3b3adf"
}
