{
  "schema_version": "1.0",
  "run_id": "RUN-038aeaa2-c00b-4e5d-a049-98185e4d14b0-R1-C1",
  "artifact_id": "ART-f3910320",
  "artifact_type": "code_lab_public",
  "agent": "code-lab",
  "status": "ready",
  "versions": {
    "prompt_version": "c-prompts-1.21.1",
    "model_config_hash": "MODEL-a54018547a29e463ea39ed85fb28e89564b7c613d55e5aaead755028568e9f40",
    "runner_image_digest": "sha256:795ed9486f10d55376e185115d5d801bc3ed51398752109b271f4c63a8356a5b",
    "profile_version": "RUN-038aeaa2-c00b-4e5d-a049-98185e4d14b0-profile-E0",
    "kb_version": "0.6.0",
    "rag_version": "rule-rag-0.1",
    "schema_version": "1.0"
  },
  "seed": 85243021950063,
  "input_refs": [
    "SPEC-bfaaa47c",
    "RAG-0dddefb21a79493d79f65032",
    "ART-25dad186"
  ],
  "citations": [
    {
      "source_id": "K001",
      "fact_id": "F001",
      "relation": "supports"
    },
    {
      "source_id": "K001",
      "fact_id": "F002",
      "relation": "supports"
    },
    {
      "source_id": "K001",
      "fact_id": "F003",
      "relation": "supports"
    },
    {
      "source_id": "K001",
      "fact_id": "F001",
      "relation": "derived_from"
    },
    {
      "source_id": "K001",
      "fact_id": "F002",
      "relation": "derived_from"
    },
    {
      "source_id": "K001",
      "fact_id": "F003",
      "relation": "derived_from"
    }
  ],
  "quality": {
    "schema_ok": true,
    "citation_coverage": 1,
    "objective_coverage": 1,
    "alignment_score": 1,
    "execution_verified": true,
    "verified_test_count": 1
  },
  "payload": {
    "lab_id": "LAB-d1d0a008",
    "title": "认识 Python：一门通用编程语言",
    "objective_ids": [
      "OBJ-K001"
    ],
    "instructions": [
      {
        "block_id": "LAB-INSTRUCTION-0014bd4d",
        "block_type": "paragraph",
        "text": "Python 是一种通用编程语言，这意味着它不局限于某一类任务，而是可以用来编写各种类型的程序。就像一把多用途的工具，既能做简单的小事，也能完成复杂的项目。\n\nPython 程序通常由解释器执行。解释器就像一个翻译官，它逐行读取你写的代码，并立刻翻译成计算机能理解的指令来运行。所以，你不需要先经过一个单独的编译步骤，写好的代码可以直接交给解释器运行。\n\nPython 适合编写脚本、数据处理和教学示例。脚本是指用来完成自动化任务的小程序；数据处理是指对信息进行整理、分析和计算；教学示例则是因为 Python 的语法清晰易懂，很适合用来学习编程。不过，这些只是它的常见用途，并不代表它只能做这些。",
        "claims": [
          {
            "claim_id": "LAB-CLAIM-d6270a35",
            "text": "Python 是一种通用编程语言。",
            "citations": [
              {
                "source_id": "K001",
                "fact_id": "F001",
                "relation": "supports"
              }
            ]
          },
          {
            "claim_id": "LAB-CLAIM-785dd3c3",
            "text": "Python 程序通常由解释器执行。",
            "citations": [
              {
                "source_id": "K001",
                "fact_id": "F002",
                "relation": "supports"
              }
            ]
          },
          {
            "claim_id": "LAB-CLAIM-00e6b485",
            "text": "Python 适合编写脚本、数据处理和教学示例。",
            "citations": [
              {
                "source_id": "K001",
                "fact_id": "F003",
                "relation": "supports"
              }
            ]
          }
        ]
      }
    ],
    "execution_contract": {
      "language": "python",
      "execution_mode": "function",
      "entry_point": "describe_python",
      "allowed_imports": [],
      "input_contract": {
        "type": "object",
        "constraints": []
      },
      "output_contract": {
        "type": "string",
        "constraints": []
      },
      "resource_limits": {
        "timeout_ms": 1000,
        "memory_mb": 64,
        "max_output_bytes": 1024
      }
    },
    "starter_code": "def describe_python():\n    \"\"\"返回一个描述 Python 的字符串。\"\"\"\n    # TODO: 返回一个包含以下三个关键点的字符串：\n    # 1. Python 是一种通用编程语言。\n    # 2. Python 程序通常由解释器执行。\n    # 3. Python 适合编写脚本、数据处理和教学示例。\n    raise NotImplementedError(\"TODO\")\n",
    "public_tests": [
      {
        "test_id": "LAB-PUBLIC-TEST-0014bd4d",
        "objective_id": "OBJ-K001",
        "description": "调用 describe_python() 应返回一个字符串，且该字符串包含 Python 是通用编程语言、由解释器执行、适合脚本/数据处理/教学示例这三个关键信息。",
        "input": {
          "args": [],
          "kwargs": {}
        },
        "expected_behavior": "返回的字符串中应包含 '通用编程语言'、'解释器'、'脚本'、'数据处理'、'教学示例' 等关键词。",
        "citations": [
          {
            "source_id": "K001",
            "fact_id": "F001",
            "relation": "derived_from"
          },
          {
            "source_id": "K001",
            "fact_id": "F002",
            "relation": "derived_from"
          },
          {
            "source_id": "K001",
            "fact_id": "F003",
            "relation": "derived_from"
          }
        ]
      }
    ],
    "hint_ladders": [
      {
        "objective_id": "OBJ-K001",
        "hints": [
          {
            "hint_level": 1,
            "text": "想一想：Python 的三个关键特点分别是什么？",
            "citations": [
              {
                "source_id": "K001",
                "fact_id": "F001",
                "relation": "derived_from"
              },
              {
                "source_id": "K001",
                "fact_id": "F002",
                "relation": "derived_from"
              },
              {
                "source_id": "K001",
                "fact_id": "F003",
                "relation": "derived_from"
              }
            ]
          },
          {
            "hint_level": 2,
            "text": "你可以用三行字符串拼接，每行描述一个特点。",
            "citations": [
              {
                "source_id": "K001",
                "fact_id": "F001",
                "relation": "derived_from"
              },
              {
                "source_id": "K001",
                "fact_id": "F002",
                "relation": "derived_from"
              },
              {
                "source_id": "K001",
                "fact_id": "F003",
                "relation": "derived_from"
              }
            ]
          },
          {
            "hint_level": 3,
            "text": "使用 return 返回一个包含所有关键点的字符串，例如用换行符分隔。",
            "citations": [
              {
                "source_id": "K001",
                "fact_id": "F001",
                "relation": "derived_from"
              },
              {
                "source_id": "K001",
                "fact_id": "F002",
                "relation": "derived_from"
              },
              {
                "source_id": "K001",
                "fact_id": "F003",
                "relation": "derived_from"
              }
            ]
          }
        ]
      }
    ],
    "reflection_questions": [
      "为什么说 Python 是通用编程语言？它和只能做单一任务的工具（比如计算器）有什么不同？"
    ],
    "objective_coverage": [
      {
        "objective_id": "OBJ-K001",
        "instruction_block_ids": [
          "LAB-INSTRUCTION-0014bd4d"
        ],
        "public_test_ids": [
          "LAB-PUBLIC-TEST-0014bd4d"
        ]
      }
    ],
    "used_evidence": [
      {
        "source_id": "K001",
        "fact_id": "F001",
        "relation": "supports"
      },
      {
        "source_id": "K001",
        "fact_id": "F002",
        "relation": "supports"
      },
      {
        "source_id": "K001",
        "fact_id": "F003",
        "relation": "supports"
      },
      {
        "source_id": "K001",
        "fact_id": "F001",
        "relation": "derived_from"
      },
      {
        "source_id": "K001",
        "fact_id": "F002",
        "relation": "derived_from"
      },
      {
        "source_id": "K001",
        "fact_id": "F003",
        "relation": "derived_from"
      }
    ]
  },
  "trace_ref": "TRACE-8a0f22d7"
}
